{
  "$schema": "./source-recovery-online-receipt.schema.json",
  "schema_version": 1,
  "policy": "official_publication_link_artifact_receipt_v1",
  "checked_at": "2026-07-22T07:45:35.886Z",
  "max_age_seconds": 259200,
  "checker": "scripts/source-recovery-online-receipt.mjs",
  "source_proof": {
    "path": "data/source-recovery-proofs.json",
    "sha256": "25cc755534095731b2f69974fbc8c3e86f1eb6da4cbf396315f9fa1100d17882",
    "bytes": 29526
  },
  "publication_pages": [
    {
      "page_url": "https://www.ictr.edu.cn/download_center/fangan.html",
      "redirect_chain": [],
      "final_url": "https://www.ictr.edu.cn/download_center/fangan.html",
      "status": 412,
      "content_type": "text/html",
      "bytes": 3120,
      "sha256": "856660fd07a8365371ac0cb45701a5bf92e425280bcda87d7713dad646158242",
      "page_status": "official_waf_interstitial",
      "verified_artifact_urls": []
    },
    {
      "page_url": "https://www.ictr.edu.cn/download_center/pt.html",
      "redirect_chain": [],
      "final_url": "https://www.ictr.edu.cn/download_center/pt.html",
      "status": 412,
      "content_type": "text/html",
      "bytes": 3040,
      "sha256": "e9029fb1c8681e177d8f276b555dd82879c6578d5683ff89547f3b01b255cc04",
      "page_status": "official_waf_interstitial",
      "verified_artifact_urls": []
    },
    {
      "page_url": "https://www.moe.gov.cn/srcsite/A06/s3331/200702/t20070202_128271.html",
      "redirect_chain": [
        {
          "url": "https://www.moe.gov.cn/srcsite/A06/s3331/200702/t20070202_128271.html",
          "status": 302,
          "location": "http://www.moe.gov.cn/srcsite/A06/s3331/200702/t20070202_128271.html"
        }
      ],
      "final_url": "http://www.moe.gov.cn/srcsite/A06/s3331/200702/t20070202_128271.html",
      "status": 200,
      "content_type": "text/html",
      "bytes": 16077,
      "sha256": "2b55f41ca096221eb1855ba67e30585f2fd655da6046c2305168451193aa9cf1",
      "page_status": "html_href_verified",
      "verified_artifact_urls": [
        "https://www.moe.gov.cn/publicfiles/business/htmlfiles/moe/cmsmedia/image//UserFiles/File/2008/04/28/2008042821/2008042821_323032.doc"
      ]
    },
    {
      "page_url": "https://www.moe.gov.cn/srcsite/A26/s8001/200303/t20030331_167349.html",
      "redirect_chain": [
        {
          "url": "https://www.moe.gov.cn/srcsite/A26/s8001/200303/t20030331_167349.html",
          "status": 302,
          "location": "http://www.moe.gov.cn/srcsite/A26/s8001/200303/t20030331_167349.html"
        }
      ],
      "final_url": "http://www.moe.gov.cn/srcsite/A26/s8001/200303/t20030331_167349.html",
      "status": 200,
      "content_type": "text/html",
      "bytes": 18331,
      "sha256": "5288904782a2caa6bc4c19c181e87a86ebdfc17f4d6aa4c476705ac91740a64d",
      "page_status": "html_href_verified",
      "verified_artifact_urls": [
        "https://www.moe.gov.cn/srcsite/A26/s8001/200303/W020241017509261651415.pdf",
        "https://www.moe.gov.cn/srcsite/A26/s8001/200303/W020241017509261718950.pdf",
        "https://www.moe.gov.cn/srcsite/A26/s8001/200303/W020241017509261927766.pdf",
        "https://www.moe.gov.cn/srcsite/A26/s8001/200303/W020241017509262535279.pdf",
        "https://www.moe.gov.cn/srcsite/A26/s8001/200303/W020241017509262875191.pdf",
        "https://www.moe.gov.cn/srcsite/A26/s8001/200303/W020241017509263167989.pdf",
        "https://www.moe.gov.cn/srcsite/A26/s8001/200303/W020241017509263736958.pdf",
        "https://www.moe.gov.cn/srcsite/A26/s8001/200303/W020241017509264242187.pdf",
        "https://www.moe.gov.cn/srcsite/A26/s8001/200303/W020241017509264436955.pdf",
        "https://www.moe.gov.cn/srcsite/A26/s8001/200303/W020241017509264681723.pdf",
        "https://www.moe.gov.cn/srcsite/A26/s8001/200303/W020241017509264845510.pdf",
        "https://www.moe.gov.cn/srcsite/A26/s8001/200303/W020241017509265140859.pdf",
        "https://www.moe.gov.cn/srcsite/A26/s8001/200303/W020241017509265849150.pdf",
        "https://www.moe.gov.cn/srcsite/A26/s8001/200303/W020241017509266056028.pdf",
        "https://www.moe.gov.cn/srcsite/A26/s8001/200303/W020241017509266150039.pdf",
        "https://www.moe.gov.cn/srcsite/A26/s8001/200303/W020241017509266253473.pdf"
      ]
    },
    {
      "page_url": "https://www.moe.gov.cn/srcsite/A26/s8001/200403/t20040302_167352.html",
      "redirect_chain": [
        {
          "url": "https://www.moe.gov.cn/srcsite/A26/s8001/200403/t20040302_167352.html",
          "status": 302,
          "location": "http://www.moe.gov.cn/srcsite/A26/s8001/200403/t20040302_167352.html"
        }
      ],
      "final_url": "http://www.moe.gov.cn/srcsite/A26/s8001/200403/t20040302_167352.html",
      "status": 200,
      "content_type": "text/html",
      "bytes": 15447,
      "sha256": "0e942979654a66093b37f7779657ab083d46dd4e6824a2e4eadd57290567891d",
      "page_status": "html_href_verified",
      "verified_artifact_urls": [
        "http://www.moe.gov.cn/srcsite/A26/s8001/200403/W020250807557231804509.doc"
      ]
    },
    {
      "page_url": "https://www.moe.gov.cn/srcsite/A26/s8001/201801/t20180115_324647.html",
      "redirect_chain": [
        {
          "url": "https://www.moe.gov.cn/srcsite/A26/s8001/201801/t20180115_324647.html",
          "status": 302,
          "location": "http://www.moe.gov.cn/srcsite/A26/s8001/201801/t20180115_324647.html"
        }
      ],
      "final_url": "http://www.moe.gov.cn/srcsite/A26/s8001/201801/t20180115_324647.html",
      "status": 200,
      "content_type": "text/html",
      "bytes": 16355,
      "sha256": "b79c56e125574e3102e5827d451779fb44da62cdc227b3e6aca1b4f64eb9f570",
      "page_status": "html_href_verified",
      "verified_artifact_urls": [
        "http://www.moe.gov.cn/srcsite/A26/s8001/201801/W020181025286384018871.rar"
      ]
    }
  ],
  "artifacts": [
    {
      "artifact_id": "archive:moe-high-school-2017-original-release",
      "document_id": null,
      "role": "official_archive",
      "publication_page_url": "https://www.moe.gov.cn/srcsite/A26/s8001/201801/t20180115_324647.html",
      "expected_href_url": "http://www.moe.gov.cn/srcsite/A26/s8001/201801/W020181025286384018871.rar",
      "observed_href_url": "http://www.moe.gov.cn/srcsite/A26/s8001/201801/W020181025286384018871.rar",
      "href_status": "verified_in_publication_html",
      "request_url": "http://www.moe.gov.cn/srcsite/A26/s8001/201801/W020181025286384018871.rar",
      "redirect_chain": [],
      "final_url": "http://www.moe.gov.cn/srcsite/A26/s8001/201801/W020181025286384018871.rar",
      "status": 200,
      "content_type": "application/x-rar-compressed",
      "bytes": 41484639,
      "sha256": "074988f6b5426eb48dc98187b66e8d010659b4b35930fe276fe6eefac6e05269"
    },
    {
      "artifact_id": "attachment:ictr-07a04c6c51fd:canonical",
      "document_id": "ictr-07a04c6c51fd",
      "role": "canonical_native_attachment",
      "publication_page_url": "https://www.ictr.edu.cn/download_center/fangan.html",
      "expected_href_url": "https://www.ictr.edu.cn/Uploads/File/2022/04/28/%E4%B9%89%E5%8A%A1%E6%95%99%E8%82%B2%E8%AF%BE%E7%A8%8B%E8%AE%BE%E7%BD%AE%E5%AE%9E%E9%AA%8C%E6%96%B9%E6%A1%88.20220428175514.docx",
      "observed_href_url": null,
      "href_status": "official_waf_interstitial_exact_artifact",
      "request_url": "https://www.ictr.edu.cn/Uploads/File/2022/04/28/%E4%B9%89%E5%8A%A1%E6%95%99%E8%82%B2%E8%AF%BE%E7%A8%8B%E8%AE%BE%E7%BD%AE%E5%AE%9E%E9%AA%8C%E6%96%B9%E6%A1%88.20220428175514.docx",
      "redirect_chain": [],
      "final_url": "https://www.ictr.edu.cn/Uploads/File/2022/04/28/%E4%B9%89%E5%8A%A1%E6%95%99%E8%82%B2%E8%AF%BE%E7%A8%8B%E8%AE%BE%E7%BD%AE%E5%AE%9E%E9%AA%8C%E6%96%B9%E6%A1%88.20220428175514.docx",
      "status": 200,
      "content_type": "application/vnd.openxmlformats-officedocument.wordprocessingml.document",
      "bytes": 25919,
      "sha256": "295e2f48a24ce372381f3f358fbbe7c3001c466506016e3b4b81e4918fb5cec4"
    },
    {
      "artifact_id": "attachment:ictr-8f02447b66ca:canonical",
      "document_id": "ictr-8f02447b66ca",
      "role": "canonical_native_attachment",
      "publication_page_url": "https://www.ictr.edu.cn/download_center/fangan.html",
      "expected_href_url": "https://www.ictr.edu.cn/Uploads/File/2022/04/28/%E7%9B%B2%E6%A0%A1%E4%B9%89%E5%8A%A1%E6%95%99%E8%82%B2%E8%AF%BE%E7%A8%8B%E8%AE%BE%E7%BD%AE%E5%AE%9E%E9%AA%8C%E6%96%B9%E6%A1%88%EF%BC%882007%E5%B9%B4%EF%BC%89.20220428175639.doc",
      "observed_href_url": null,
      "href_status": "official_waf_interstitial_exact_artifact",
      "request_url": "https://www.ictr.edu.cn/Uploads/File/2022/04/28/%E7%9B%B2%E6%A0%A1%E4%B9%89%E5%8A%A1%E6%95%99%E8%82%B2%E8%AF%BE%E7%A8%8B%E8%AE%BE%E7%BD%AE%E5%AE%9E%E9%AA%8C%E6%96%B9%E6%A1%88%EF%BC%882007%E5%B9%B4%EF%BC%89.20220428175639.doc",
      "redirect_chain": [],
      "final_url": "https://www.ictr.edu.cn/Uploads/File/2022/04/28/%E7%9B%B2%E6%A0%A1%E4%B9%89%E5%8A%A1%E6%95%99%E8%82%B2%E8%AF%BE%E7%A8%8B%E8%AE%BE%E7%BD%AE%E5%AE%9E%E9%AA%8C%E6%96%B9%E6%A1%88%EF%BC%882007%E5%B9%B4%EF%BC%89.20220428175639.doc",
      "status": 200,
      "content_type": "application/msword",
      "bytes": 77824,
      "sha256": "2ae0ca0a23a50d82de3958fa41d5855aec3d4a384c27e25af8215fbe1bc64e7b"
    },
    {
      "artifact_id": "attachment:ictr-a027c4d6e30e:canonical",
      "document_id": "ictr-a027c4d6e30e",
      "role": "canonical_native_attachment",
      "publication_page_url": "https://www.moe.gov.cn/srcsite/A26/s8001/200403/t20040302_167352.html",
      "expected_href_url": "http://www.moe.gov.cn/srcsite/A26/s8001/200403/W020250807557231804509.doc",
      "observed_href_url": "http://www.moe.gov.cn/srcsite/A26/s8001/200403/W020250807557231804509.doc",
      "href_status": "verified_in_publication_html",
      "request_url": "http://www.moe.gov.cn/srcsite/A26/s8001/200403/W020250807557231804509.doc",
      "redirect_chain": [],